{
  "schema_kind": "odd_domain.treatment_surface",
  "schema_version": "v1",
  "treatment_id": "odd_domain.treatment.apra_liquidity.reporting_position.classification.v1",
  "source_object_refs": [
    "odd_domain.markov_object.apra_liquidity.reporting_position.apra_liquidity_position_001"
  ],
  "target_domain": "odd_domain.domain.apra_liquidity.reporting.sandbox.v1",
  "preserved_structure": [
    "counterparty_bucket",
    "agreement_assessment",
    "liquidity_bucket"
  ],
  "changed_meaning": [
    "Source evidence is rendered as a regulatory reporting position rather than a trade confirmation object."
  ],
  "loss_notes": [
    "Upstream trade and product semantics are narrowed into regulatory reporting semantics."
  ],
  "surplus_notes": [
    "APRA-liquidity view adds reporting-bucket semantics."
  ]
}
